{
  "version": 2,
  "kind": "markdown",
  "output": "sample.hwpx",
  "title": "기관 AX 전략 특강 운영계획",
  "metadata_date": "2026-08-25",
  "profile": "public",
  "facts": {
    "date": "2026. 8. 25.",
    "time": "15:00∼17:30",
    "fee": "무료"
  },
  "blocks": [
    {
      "type": "heading",
      "text": "운영 개요"
    },
    {
      "type": "table",
      "headers": [
        "구분",
        "내용"
      ],
      "rows": [
        [
          "일시",
          "2026. 8. 25. 15:00∼17:30"
        ],
        [
          "참가비",
          "무료"
        ],
        [
          "대상",
          "검증용 가상기관 구성원"
        ]
      ]
    },
    {
      "type": "heading",
      "text": "AX 실행 흐름"
    },
    {
      "type": "diagram",
      "pattern": "process",
      "nodes": [
        {
          "id": "diagnose",
          "title": "현황 진단",
          "text": "업무·데이터 현황 분석",
          "role": "기획부서"
        },
        {
          "id": "select",
          "title": "우선과제 선정",
          "text": "효과와 실행 가능성 검토",
          "role": "현업부서"
        },
        {
          "id": "pilot",
          "title": "시범 적용",
          "text": "검증 후 성과 공유",
          "role": "현업부서"
        }
      ],
      "edges": [
        {
          "from": "diagnose",
          "to": "select",
          "label": "진단 결과"
        },
        {
          "from": "select",
          "to": "pilot",
          "label": "선정 과제"
        }
      ]
    },
    {
      "type": "paragraph",
      "text": "특강 이후 부서별 실행 과제 발굴 및 적용 결과 공유"
    }
  ],
  "quality": {
    "hancom": "off"
  }
}
